{
  "schema_version": 1,
  "role": "public_prerequisite",
  "release": {
    "version": "1.3.4",
    "tag": "v1.3.4",
    "candidate_commit_sha": "f03c78bab54efe1cd1596d51cf3f28193232e2a3"
  },
  "facts": {
    "version": "1.3.4",
    "v1_3_2_run_id": "32586098785",
    "public_archive_sha256": "a6048f87aa54a8467374c56bab87d25be26e8c835e8cf8f06050573f8c4a7c80",
    "release_event": "push",
    "v1_3_2_hexdocs_absent": true,
    "sealed_metadata_sha256": "52d92fd928453dcf23c1dd0ef1fc0daf699c1de97b68ce3cadb6c5cb0c8564b3",
    "v1_3_1_peeled_sha": "7afb1dd056bba234d1bd4ec1c4487f2ea8e308f1",
    "v1_3_3_tag_object_sha": "c96bf205d7216cdcf4846a0f24a312f9c1c75b0f",
    "v1_3_2_validate_job_id": "97062582546",
    "hexdocs_conclusion": "success",
    "v1_3_3_validate_job_conclusion": "failure",
    "v1_3_3_verifier_absent": true,
    "v1_3_2_publish_job_id": "97064173653",
    "v1_3_0_hexdocs_absent": true,
    "release_name": "Release to Hex",
    "release_conclusion": "success",
    "tag": "v1.3.4",
    "hexdocs_name": "HexDocs",
    "sealed_manifest_sha256": "d2ba1a33339d501291736c67df74cbed3ef46f5063409043ac7d6f4f38012f9e",
    "v1_3_3_run_id": "32596108284",
    "v1_3_3_conclusion": "failure",
    "docs_provenance_run_id": "32898926521",
    "v1_3_1_publish_job_skipped": true,
    "release_head_sha": "f03c78bab54efe1cd1596d51cf3f28193232e2a3",
    "v1_3_0_peeled_sha": "3d014b8194782fc29bc685c0d5e84e4adc64b2c3",
    "peeled_tag_sha": "f03c78bab54efe1cd1596d51cf3f28193232e2a3",
    "v1_3_0_run_id": "32513353551",
    "release_publish_job_conclusion": "success",
    "v1_3_3_publish_job_id": "97088652899",
    "release_validate_job_conclusion": "success",
    "v1_3_1_run_id": "32539594278",
    "candidate_commit_sha": "f03c78bab54efe1cd1596d51cf3f28193232e2a3",
    "v1_3_2_hex_absent": true,
    "v1_3_3_hexdocs_dispatch_absent": true,
    "sealed_archive_sha256": "7c886783fa1f73b2b154b4840295e6092b3f26e7bf568203476d204b0c0c369a",
    "v1_3_3_hex_absent": true,
    "v1_3_1_conclusion": "cancelled",
    "public_prerequisite": "VERIFIED",
    "hex_version": "1.3.4",
    "v1_3_2_peeled_sha": "47af6448d2989ffe69c4b80c77935c896b1ddb07",
    "public_manifest_sha256": "d2ba1a33339d501291736c67df74cbed3ef46f5063409043ac7d6f4f38012f9e",
    "v1_3_1_tag_object_sha": "b386d1e39b6c9e63af58aa1fa5890d93909d278f",
    "v1_3_3_publish_job_conclusion": "skipped",
    "release_publish_job_id": "97549444486",
    "v1_3_2_tag_object_sha": "9b7ff50c69c0e9bd6ae39f0c79f76c4663d936fd",
    "hexdocs_provenance": "hexdocs_workflow_dispatch",
    "v1_3_1_hexdocs_absent": true,
    "release_validate_job_id": "97546095415",
    "hexdocs_symbols": [
      "Rendro.Theme",
      "Rendro.Theme.Presets",
      "Rendro.Adapters.Phoenix.render_pdf/3"
    ],
    "hexdocs_event": "workflow_dispatch",
    "v1_3_1_hex_absent": true,
    "v1_3_2_conclusion": "failure",
    "public_metadata_sha256": "52d92fd928453dcf23c1dd0ef1fc0daf699c1de97b68ce3cadb6c5cb0c8564b3",
    "hexdocs_candidate_binding": {
      "control_ref": "refs/heads/main",
      "control_sha": "f9b63246029396f76c443c5750aad42a3004081b",
      "detached_artifact_head": "f03c78bab54efe1cd1596d51cf3f28193232e2a3",
      "peeled_tag_sha": "f03c78bab54efe1cd1596d51cf3f28193232e2a3",
      "requested_artifact_sha": "f03c78bab54efe1cd1596d51cf3f28193232e2a3",
      "tag": "v1.3.4",
      "workflow_event": "workflow_dispatch",
      "workflow_name": "HexDocs",
      "workflow_run_id": "32898926521"
    },
    "hexdocs_version": "1.3.4",
    "archive_members": [
      "lib/rendro/release/streaming_command_capture.ex",
      "lib/rendro/section.ex",
      "lib/rendro/theme/snippet.ex",
      "lib/rendro/theme/presets.ex",
      "lib/rendro/recipes/invoice.ex",
      "lib/rendro/recipes/certificate.ex",
      "lib/rendro/recipes/statement.ex",
      "lib/rendro/recipes/pagination.ex",
      "lib/rendro/recipes/receipt.ex",
      "lib/rendro/recipes/branded_invoice.ex",
      "lib/rendro/recipes/table_cell.ex",
      "lib/rendro/recipes/payslip.ex",
      "lib/rendro/recipes/ticket.ex",
      "lib/rendro/recipes/background.ex",
      "lib/rendro/pipeline.ex",
      "lib/rendro/region.ex",
      "lib/rendro/artifact.ex",
      "lib/rendro/sign/adapter.ex",
      "lib/rendro/running_content.ex",
      "lib/rendro/i18n/analyzer.ex",
      "lib/rendro/audit.ex",
      "lib/rendro/public_api/validator.ex",
      "lib/rendro/public_api/loader.ex",
      "lib/rendro/inspector.ex",
      "lib/rendro/storage.ex",
      "lib/rendro/color.ex",
      "lib/rendro/page.ex",
      "lib/rendro/cell.ex",
      "lib/rendro/protect.ex",
      "lib/rendro/public_api.ex",
      "lib/rendro/format.ex",
      "lib/rendro/font_registry.ex",
      "lib/rendro/row.ex",
      "lib/rendro/theme.ex",
      "lib/rendro/examples.ex",
      "lib/rendro/branded.ex",
      "lib/rendro/asset_registry.ex",
      "lib/rendro/launch_artifacts.ex",
      "lib/rendro/text/shaper/simple.ex",
      "lib/rendro/text/script_tags.ex",
      "lib/rendro/text/bidi.ex",
      "lib/rendro/text/shaper.ex",
      "lib/rendro/examples_data.ex",
      "lib/rendro/page_template.ex",
      "lib/rendro/metadata.ex",
      "lib/rendro/embedded_file_registry.ex",
      "lib/rendro/telemetry.ex",
      "lib/rendro/table.ex",
      "lib/rendro/viewer_evidence/observation_environment.ex",
      "lib/rendro/viewer_evidence/matrix.ex",
      "lib/rendro/viewer_evidence/links_pdfium_proof.ex",
      "lib/rendro/viewer_evidence/protection_acrobat_proof.ex",
      "lib/rendro/viewer_evidence/forms_pdfium_proof.ex",
      "lib/rendro/viewer_evidence/signature_widget_apple_preview_proof.ex",
      "lib/rendro/viewer_evidence/validator.ex",
      "lib/rendro/viewer_evidence/recorder.ex",
      "lib/rendro/viewer_evidence/protection_poppler_proof.ex",
      "lib/rendro/viewer_evidence/forms_apple_preview_proof.ex",
      "lib/rendro/viewer_evidence/lint.ex",
      "lib/rendro/viewer_evidence/signature_widget_acrobat_proof.ex",
      "lib/rendro/viewer_evidence/forms_acrobat_proof.ex",
      "lib/rendro/viewer_evidence/embedded_files_pdfium_proof.ex",
      "lib/rendro/viewer_evidence/frontmatter.ex",
      "lib/rendro/rules/check_required_keys.ex",
      "lib/rendro/rules/check_ids.ex",
      "lib/rendro/rules/check_embedded_files.ex",
      "lib/rendro/rules/check_references.ex",
      "lib/rendro/rules/check_bounds.ex",
      "lib/rendro/rules/check_form_fields.ex",
      "lib/rendro/rules/check_links.ex",
      "lib/rendro/document.ex",
      "lib/rendro/form_field.ex",
      "lib/rendro/block.ex",
      "lib/rendro/adapters/pdfsig.ex",
      "lib/rendro/adapters/phoenix.ex",
      "lib/rendro/adapters/harfbuzz.ex",
      "lib/rendro/adapters/long_lived_acrobat_proof.ex",
      "lib/rendro/adapters/py_hanko.ex",
      "lib/rendro/adapters/poppler.ex",
      "lib/rendro/adapters/threadline.ex",
      "lib/rendro/adapters/accrue.ex",
      "lib/rendro/adapters/signed_artifact_pdfium_proof.ex",
      "lib/rendro/adapters/pdfium.ex",
      "lib/rendro/adapters/signing_preparation_pdfium_proof.ex",
      "lib/rendro/adapters/signed_artifact_acrobat_proof.ex",
      "lib/rendro/adapters/signature_widget_pdfium_proof.ex",
      "lib/rendro/adapters/qpdf.ex",
      "lib/rendro/adapters/mailglass.ex",
      "lib/rendro/adapters/oban/render_worker.ex",
      "lib/rendro/image.ex",
      "lib/rendro/pipeline/validate.ex",
      "lib/rendro/pipeline/compose.ex",
      "lib/rendro/pipeline/measure.ex",
      "lib/rendro/pipeline/measured_text.ex",
      "lib/rendro/pipeline/render.ex",
      "lib/rendro/pipeline/paginate.ex",
      "lib/rendro/pipeline/build.ex",
      "lib/rendro/fragmentable.ex",
      "lib/rendro/error.ex",
      "lib/rendro/page_size.ex",
      "lib/rendro/comparison.ex",
      "lib/rendro/path.ex",
      "lib/rendro/pdf/font_subsetter.ex",
      "lib/rendro/pdf/cid_font.ex",
      "lib/rendro/pdf/font_parser.ex",
      "lib/rendro/pdf/font.ex",
      "lib/rendro/pdf/writer.ex",
      "lib/rendro/pdf/object.ex",
      "lib/rendro/pdf/png.ex",
      "lib/rendro/component.ex",
      "lib/rendro/sign.ex",
      "lib/rendro/storage/local.ex",
      "lib/rendro/image_parser.ex",
      "lib/rendro/recipes.ex",
      "lib/rendro/text.ex",
      "lib/rendro/protect/adapter.ex",
      "lib/rendro/link.ex",
      "lib/mix/tasks/release/preflight.ex",
      "lib/mix/tasks/rendro/viewer_evidence.ex",
      "lib/mix/tasks/rendro/gen/theme.ex",
      "lib/mix/tasks/rendro/comparison/check.ex",
      "lib/mix/tasks/rendro/comparison/gen.ex",
      "lib/mix/tasks/rendro/livebook/check.ex",
      "lib/mix/tasks/rendro/api.gen.ex",
      "lib/mix/tasks/rendro/launch_artifacts/check.ex",
      "lib/mix/tasks/rendro/launch_artifacts/gen.ex",
      "lib/mix/tasks/docs.contract.ex",
      "lib/mix/tasks/rendro.visual_uat.ex",
      "lib/mix/tasks/brand.gen.ex",
      "lib/mix/tasks/verify.ex",
      "lib/rendro.ex",
      "assets/rendro/artifacts.json",
      "assets/rendro/catalog/receipt/circuit-supply-co/minimal-mono-light.png",
      "assets/rendro/catalog/receipt/circuit-supply-co/minimal-mono-dark.png",
      "assets/rendro/catalog/receipt/poppy-and-grain/humanist-light.png",
      "assets/rendro/catalog/receipt/poppy-and-grain/humanist-dark.png",
      "assets/rendro/catalog/receipt/default/default-light.png",
      "assets/rendro/catalog/statement/signal-ledger/minimal-mono-light.png",
      "assets/rendro/catalog/statement/signal-ledger/minimal-mono-dark.png",
      "assets/rendro/catalog/statement/default/default-light.png",
      "assets/rendro/catalog/statement/aster-research-fund/editorial-dark.png",
      "assets/rendro/catalog/statement/aster-research-fund/editorial-light.png",
      "assets/rendro/catalog/certificate/aster-institute/swiss-dark.png",
      "assets/rendro/catalog/certificate/aster-institute/swiss-light.png",
      "assets/rendro/catalog/certificate/meridian-arts-fellowship/editorial-dark.png",